term,category,tags,short_def,definition,related_terms,legal_basis,importance,explanation,article_title,article_lead,term_detail_body,exam_points,common_mistakes,memory_tip,example_question,example_answer,faq_1_question,faq_1_answer,faq_2_question,faq_2_answer,faq_3_question,faq_3_answer,faq_4_question,faq_4_answer,diagram_id,slug,related_links,fact_checked_at
有価証券,金融商品・サービス,金商法;基本;編集合格,第1項は国債証券·株券·受益証券·CP等を列挙し、第2項は投信を除く信託受益権等を第二項有価証券として定める,有価証券とは、金融商品取引法第2条で定められたものです。第1項は国債証券·社債券·株券·新株予約権·投資信託の受益証券·コマーシャル·ペーパーなどを個別に列挙します。第2項は、第1項に加えて同項各号の権利を有価証券に含めます。試験でいう第二項有価証券の中心は、投資信託の受益証券を除く信託受益権と集団投資スキーム持分です。,株式;社債;受益権,金融商品取引法第2条,A,四択では、第1項と第二項有価証券の入れ替え、投信受益証券（第1項）と不動産信託等の受益権（第二項）の混同、約束手形とCPの区別、新株予約権の項区分が繰り返し出ます。問題文で「第1項のみ」「第二項有価証券」「投信を除く」などの限定語を先に確認してください。,証券外務員試験の有価証券とは？一項·二項の違いと覚え方,証券外務員試験の「有価証券」は、金商法第2条の**第1項（列挙）**と**第2項（みなし）**の2段構えが核心です。投信は受益証券として第1項、一般の約束手形は原則対象外ですが、要件を満たす**コマーシャル·ペーパー（CP）**は第1項第15号です。「第2項に規定されるもの」と「第二項有価証券」の違いも整理します。,"第2条第1項は列挙方式で、株券·新株予約権·投資信託の受益証券·コマーシャル·ペーパーなどを号ごとに定めます。第2項は、第1項のほかに同項各号の権利を有価証券に含めます。

第2条第2項に規定されるものは、条文が列挙する権利全体を指します。試験·実務でいう第二項有価証券は、そのうち流動性が相対的に低い類型（投資信託の受益証券を除く信託受益権、集団投資スキーム持分など）を第二種金融商品取引業の対象として整理するときの呼び方です。第2項各号に該当しても電子記録移転権利として第1項に入るなど例外があるため条文と府令で確認してください。

投資信託は受益証券として第1項に列挙され、第2項の信託受益権からは投資信託の受益証券が除かれます。したがって投信を「信託受益権＝第2項」と一括りにしないことが重要です。新株予約権は第1項（株券·新株予約権証券の枠）です。

約束手形·小切手は原則、金商法第2条の射程外です。ただし内閣府令の要件を満たすコマーシャル·ペーパーは第1項第15号の有価証券です。一般の約束手形とCPを混同しないでください。預金·保険契約も第2条の列挙·みなしには入りません。

確認問題の例：投資信託の受益証券は第1項（正）。不動産信託の信託受益権は第二項有価証券（正）。新株予約権は第1項（正）。一般の約束手形は金商法上の有価証券（誤）。要件を満たすCPは第1項（正）。普通預金残高は第2条の有価証券（誤）。",投資信託の受益証券は第1項、投信を除く信託受益権は第二項有価証券と分ける;新株予約権は第1項であることを確認する;一般の約束手形は原則対象外、CPは第1項第15号の例外と整理する;第2項各号の権利と第二項有価証券の呼び分けを条文とセットで確認する,新株予約権を第二項有価証券とする誤りがあります。新株予約権は第1項です。投資信託を信託受益権だから第2項とする誤りも典型で、投信は受益証券として第1項、第2項からは除かれます。約束手形をすべて非該当とする肢は、CP（第1項第15号）の例外を見落とした誤答です。,1項＝列挙（株券·受益証券·CP·新株予約権）。2項＝投信を除く受益権·組合持分。手形は原則外·CPは第1項、と3語セット。,次のうち、金融商品取引法上の第一項有価証券として正しいものはどれか。,正解は「投資信託の受益証券」です。株券·新株予約権·CPは第1項、投信を除く信託受益権は第二項有価証券です。一般の約束手形は原則対象外ですが、要件を満たすCPは第1項に該当します。,有価証券とは何ですか？,金融商品取引法第2条で定義される概念です。第1項は国債証券·社債券·株券·新株予約権·投資信託の受益証券·コマーシャル·ペーパーなどを**列挙**します。第2項は第1項に加え、投資信託の受益証券を除く信託受益権などを**みなし有価証券（第二項有価証券）**として含めます。たとえば上場会社の株券は第1項、不動産信託の受益権は第二項有価証券です。,第2項に規定されるものと第二項有価証券の違いは？,**第2条第2項に規定されるもの**は、同項各号が列挙する権利全体です。条文は「前項のほか、次に掲げるものを**含む**」と定めます。**第二項有価証券**は、試験·実務上の呼び方で、投信を除く信託受益権·集団投資スキーム持分など、第二種金融商品取引業の規制対象として整理される類型を指します。第2項各号に該当しても、電子記録移転権利として第1項に入る場合など区分が変わる例外があるため、[金融商品取引法第2条（e-Gov）](https://elaws.e-gov.go.jp/document?lawid=405AC0000000025)の条文原文で確認してください。,預金や約束手形は有価証券ですか？,預金·保険契約は**金融商品取引法第2条上の有価証券には原則該当しません**。一般の約束手形·小切手も、商法上の有価証券ですが金商法第2条の列挙·みなしには入りません。**例外**として、内閣府令の要件を満たす**コマーシャル·ペーパー（CP）**は第1項第15号の第一項有価証券です。「手形だからすべて非該当」という肢は、CPの例外を見落とした誤答です。,投資信託は第1項と第2項のどちらですか？,**投資信託の受益証券は第1項**に列挙されます。第2項の信託受益権には、条文上**投資信託の受益証券を除く**と明記されています。したがって「投信の信託受益権＝第2項」と覚えるのは誤りです。受益証券（第1項）と、投信を除く信託受益権（第二項有価証券）をセットで整理してください。,,,field-limit-basics:金融商品分野の基礎対策;field-limit-past-question-focus:金融商品分野の出題焦点;confusing-terms:混同しやすい用語の整理,2026-06-16
株式,金融商品・サービス,株式;基本;編集合格,株式会社への出資持分（株主としての社員たる地位）。株券はその表示方法、上場株は口座簿記が原則,株式は会社法上の出資持分（株主としての社員たる地位）であり、株券は金商法上の表示用有価証券です。上場株は原則口座簿記で、社債のように元本保証や満期償還はありません。,有価証券;普通株式;社債,会社法;金融商品取引法第2条,A,株式と株券の混同、株主＝債権者、元本保証·定額配当の断定が繰り返し出ます。正解の型は「出資持分」「社員としての権利」側です。試験用語で「株主の権利を表示する有価証券」と出る場合は株券の側面を問う設問であることが多い—この点にも注意してください。,証券外務員試験の株式とは？出資持分と株券の違い,証券外務員試験の「株式」は、**出資持分（会社法）**と**株券（金商法上の表示）**を分けて覚えるのが核心です。上場株は**口座簿記**が原則で、100株で**1単元**となる場面も多いです。社債との違いは**出資者／債権者**、議決権は**種類株·単元未満株**に例外がある点も押さえます。,"会社法上、株式は株式会社の**出資持分**です。株主は**社員**として株主総会で議決権を行使し、剰余金があれば配当を請求できます。「株主＝会社の所有者」と短絡せず、出資者としての権利義務（有限責任等）で理解してください。議決権は原則1株1票ですが、**種類株式**で議決権を付さない設計があり、**単元未満株式**は原則として議決権を行使できません。

金融商品取引法第2条第1項は**株券**を第一項有価証券として列挙します。**株券は株式を表示する有価証券**であり、株式そのものと同一語ではありません。**上場株式**は原則**株券を発行せず**、証券保管振替機構等の**口座簿記**で管理されます。東証等では**単元株式数**が原則100株のため、普通株100株保有は**1単元分**の株式です（100株＝100単元ではありません）。

四択では社債型の誤り（元本保証·定額配当·債権者混同）が定番です。問題文で出資者か債権者かを先に確認してください。

確認例：出資持分である（正）。株主＝金銭債権者（誤）。上場株は口座簿記（正）。100株＝100単元（誤）。種類株はすべて議決権あり（誤）。",株式（出資持分）と株券（有価証券としての表示）を分けて説明できる;上場株式は原則株券を発行せず口座簿記で管理される;単元株式数（原則100株）と1株1票·議決権の例外（種類株·単元未満株）を整理する;株主は出資者であり社債権者ではない—元本非保証·償還なしを社債と対比する,株式と株券を同一視する誤りが多いです。株式＝持分、株券＝表示、と分けてください。株主を金銭債権者とする肢、100株＝100単元とする肢も典型です。議決権は種類株·単元未満株で例外があるため「必ず行使できる」とは限りません。,持分（株式）≠表示（株券）。上場＝口座簿記、100株＝1単元。株≠債。議決権に例外あり。,"株式に関する次の記述のうち、正しいものはどれか。
（1）株主は、会社に対する金銭債権者（貸主）である。
（2）株式会社への出資持分であり、株主は社員として議決権等を有する。
（3）配当は、毎年必ず同額が支払われる。
（4）上場株式は、原則として株券を発行し紙面で管理される。",正解は（2）です。株式は会社法上の出資持分で、株主は社員として議決権·配当請求権等を有します。（1）は社債権者との混同、（3）は配当非保証、（4）は上場株の口座簿記（電子管理）と逆です。なお四択で「株主の権利を表示する有価証券」と出る場合は株券の側面を問うことがあります。,株式と株券の違いは？,**株式**は会社法上の**出資持分**（株主としての社員たる地位）です。**株券**は金商法上、**株式を表示する有価証券**です—同一語ではありません。非上場会社でも株式（持分）は存在しますが、株券の発行·記載方法は会社の選択や法制に従います。まず「持分」と「表示」を2列で書き分ける練習から始めてください。,株式と社債の違いは？,**株式**は出資持分で、株主は**社員**として権利を行使します。**社債**は会社への貸付（債権）で、利息·満期償還を請求できます。「株主＝会社の所有者」ではなく出資者、と整理してください。四択の「株主＝債権者」は定番の誤答です。[会社法（e-Gov）](https://elaws.e-gov.go.jp/document?lawid=417AC0000000086)で社員·株式の条文を確認してください。,議決権はいつでも行使できますか？,**必ずしもそうではありません。**原則は1株1票ですが、**種類株式**で議決権を付さない設計があり、**単元未満株式**は原則議決権を行使できません（会社法第189条第2項）。配当も剰余金の範囲で決議され、毎年同額が保証されるわけではありません。演習10問で「議決権なし種類株」「単元未満」のタグ付け復習が有効です。,上場株式はどのように管理されますか？,原則**株券を発行せず**、証券保管振替機構等の**口座簿記**（電子管理）です。売買単位は**単元株式数**（東証等では原則**100株＝1単元**）で設定されます。100株保有は1単元分の株式であり、「100株＝100単元」ではありません。用語「上場株式」「単元株式数」とセットで確認してください。,,,field-limit-basics:金融商品分野の基礎対策;field-limit-past-question-focus:金融商品分野の出題焦点;confusing-terms:混同しやすい用語の整理,2026-06-16
普通株式,金融商品・サービス,株式;基本;編集合格,議決権·利益配当請求権·残余財産分配請求権を通常どおり行使できる会社法上の標準的な株式（種類株の対比で出題）,普通株式は、株式会社の最も基本的な株式類型です。原則として1株1票の議決権と、剰余金配当·残余財産分配請求権を有します。試験では種類株式·優先株式との権利内容の差を問う対比軸として頻出です。,株式;種類株式;優先株式,会社法第108条;会社法第189条,B,普通株式と優先株式·種類株式の「完全同一」肢、株式全体との同一視、社債型の誤りが定番です。正解の型は「標準型」「1株1票」「3権を原則保有」側です。問題文で「種類株式」と出たら普通株以外、「最も基本的な株式」と出たら普通株、と語のトリガーを先に確認してください。,証券外務員試験の普通株式とは？種類株との違いと株主権,証券外務員試験の「普通株式」は、**標準型の株式**として**議決権·配当·残余財産分配**の3権を原則どおり持つ点が核心です。**1株1票**（会社法第189条）と、**種類株式・優先株式**との「常に同一ではない」対比をセットで覚えます。「株式」全体との包含関係も混同しやすい論点です。,"会社法第189条は、株主総会における議決権行使を定め、原則**1株1票**とします。普通株式の株主は、通常**議決権**·**利益配当請求権**·**残余財産分配請求権**を有します。定款で権利内容を分けない場合の標準株が普通株式です。

会社法第108条は、配当·残余財産·議決権等の内容が異なる二以上の**種類株式**を発行できるように定めます。「定款により内容が異なる複数種類の株式のうち、**普通株式以外**の株式」と整理するのが定番です。**優先株式**は配当·残余財産で普通株より**優先**され得る代表例です（議決権制限の設計もあり得る）。「普通株＝優先株＝常に同一」という肢は誤答です。

条文上、**普通株式**という語の単独定義はありません。上位概念の**株式**（出資持分）の**類型の一つ**であり、「株式＝普通株式のみ」と短絡しません。CB·転換社債は転換前は社債、新株予約権は行使前は株式ではありません。同じ普通株式の株主間では**株主平等の原則**により、配当·議決権等を不平等に扱えません（種類間の差異とは別）。

確認例：1株1票（正）。優先株と常に同一（誤）。種類株＝普通株を含む総称（誤）。社債型の利息請求（誤）。",普通株式は標準型で、原則1株1票·利益配当·残余財産分配の3権を整理する;種類株式は普通株式以外、優先株式は配当等で優先され得る種類株と対比する;株式（出資持分）と普通株式（類型）の包含関係を混同しない,普通株式と優先株式を常に同一視する誤りが多いです。種類株式を「普通株を含む総称」とする肢も典型です。株式（出資持分）と普通株式（類型）の包含関係を逆にするパターン、CBを最初から普通株とする肢も見落としやすいです。,普通＝標準型。1株1票＋配当＋残余。種類株＝普通以外。優先＝配当等で先行。株式⊃普通株。,"普通株式に関する次の記述のうち、正しいものはどれか。
（1）優先株式と権利内容が常に完全に同一である。
（2）原則として1株につき1個の議決権を有する。
（3）会社に対する金銭債権者として利息を請求できる。
（4）種類株式とは、普通株式を含むすべての株式の総称である。",正解は（2）です。普通株式は株式会社の標準的な株式で、原則1株1票の議決権を有します。（1）は優先株式等との混同、（3）は社債権者との混同、（4）は種類株式の定義（普通株**以外**）と逆です。配当·残余財産分配請求権も原則として有しますが、毎期必ず配当があるわけではありません。,普通株式とは何ですか？,**普通株式**は、株式会社の**最も基本的な株式類型**です。原則として**議決権**（1株1票·会社法第189条）、**利益配当請求権**、**残余財産分配請求権**を有します。定款で権利内容を分けない場合の標準株がこれに当たります。まず3権と1株1票を1行ずつ書けるようにしてください。,種類株式·優先株式との違いは？,試験では**種類株式＝普通株式以外**（会社法第108条の類型）と覚えます。**優先株式**は配当·残余財産で普通株より**優先**され得る代表例です。「常に完全同一」「種類株＝普通株を含む総称」は定番の誤答です。普通株／優先株／種類株を「議決権·配当·残余」の表で比較すると整理しやすいです。,「株式」と普通株式は同じですか？,**同一ではありません。****株式**は会社法上の**出資持分**（社員たる地位）を指し、**普通株式**はその**類型の一つ**です。CBや転換社債は転換前は社債、新株予約権も行使前は株式ではありません。用語「株式」記事の持分·株券の整理とセットで復習してください。,試験でどう問われますか？,二種·一種とも**1株1票**、**優先株との差**、**株主平等**が中心です。演習では第301問（1株1票）·第1272問（基本型）·種類株との五肢（完全同一肢）を優先復習してください。合否は総合**7割**（二種70問120分·300点·210点、一種100問160分·440点·308点）—分野別足切りはありません。,,,field-limit-basics:金融商品分野の基礎対策;field-limit-past-question-focus:金融商品分野の出題焦点;confusing-terms:混同しやすい用語の整理,2026-06-16
